classifier_id,classifier_score_name,n_required_genes,preferred_min_coverage_pct,absolute_min_coverage_pct,score_direction_higher_means,scoring_rule,main_analysis_use
PAM50,PAM50 non-luminal affinity score,50,80,50,greater basal/HER2-enriched than luminal/normal centroid affinity; approximate pCR-favorable biology,"Spearman correlation to PAM50 centroids using available genes; score=max(Basal,Her2)-max(LumA,LumB,Normal); subtype=max centroid.",eligible_if_preferred_coverage_met
MAMMAPRINT_70,MammaPrint approximate poor-prognosis score,51,80,50,higher approximate poor-prognosis expression pattern; not a pCR-specific direction,Weighted z-score using negative genefu gene70 correlation weights; clinical MammaPrint cutoff is not reconstructed.,eligible_if_preferred_coverage_met_else_exploratory
ONCOTYPE_DX_21,OncotypeDX approximate weighted expression score,16,80,50,higher approximate recurrence/proliferation weighted expression; not the commercial recurrence score,Weighted z-score using non-reference genefu OncotypeDX weights; commercial algorithm is not reconstructed.,eligible_if_preferred_coverage_met
GGI_128_PROBE,GGI grade-3 minus grade-1 expression score,99,80,50,higher histologic-grade/proliferation-like expression,Mean z-score of grade 3 genes minus mean z-score of grade 1 genes from genefu GGI object.,eligible_if_preferred_coverage_met
GENE76,Wang 76-gene weighted risk score,58,80,50,higher distant-metastasis risk-like expression; not pCR-specific,Weighted z-score using genefu Wang 76-gene Cox coefficients; ER-specific clinical rule is not reconstructed.,eligible_if_preferred_coverage_met
ENDOPREDICT_11,EndoPredict approximate weighted expression score,8,80,50,higher recurrence-risk-like expression in ER-positive/HER2-negative context,Weighted z-score using genefu EndoPredict GOI weights; clinical calibration is not reconstructed.,secondary_HR_positive_context
IFNG_18,IFN-gamma 18-gene mean z score,18,80,50,higher interferon-gamma immune activation,Mean z-score of the 18 IFN-gamma profile genes.,secondary_mechanistic_score
CYTOLYTIC_ACTIVITY_2,Cytolytic activity mean z score,2,100,100,higher local cytolytic activity,Mean z-score of GZMA and PRF1; requires both genes.,secondary_mechanistic_score
